subject,difficulty,topic,question,options,answer,hint
history,easy,Смутное время,Какой праздник отмечается в России 4 ноября?,"[""День народного единства"", ""День Победы"", ""День России"", ""День Конституции""]",День народного единства,Связан с освобождением Москвы в 1612 году
history,easy,Распад СССР,В каком году распался СССР?,"[""1991"", ""1989"", ""1993"", ""1985""]",1991,Это произошло в декабре
history,easy,Древняя Русь,При каком князе был составлен первый письменный свод законов «Русская Правда»?,"[""Ярославе Мудром"", ""Владимире Святом"", ""Олеге Вещем"", ""Святославе""]",Ярославе Мудром,Этот князь правил в XI веке
history,easy,Космонавтика,В каком году Юрий Гагарин совершил первый полёт в космос?,"[""1961"", ""1957"", ""1963"", ""1969""]",1961,Полёт состоялся 12 апреля
history,medium,Древняя Русь,Какое событие произошло в 862 году согласно «Повести временных лет»?,"[""Призвание варягов"", ""Крещение Руси"", ""Основание Киева"", ""Поход на Византию""]",Призвание варягов,Связано с приглашением Рюрика
history,medium,Феодальная раздробленность,Какой съезд князей в 1097 году закрепил принцип «каждый да держит отчину свою»?,"[""Любечский"", ""Витичевский"", ""Долобский"", ""Киевский""]",Любечский,Съезд был созван для прекращения междоусобиц
history,medium,Монгольское нашествие,Какой город оборонялся от монголов 7 недель в 1238 году?,"[""Козельск"", ""Рязань"", ""Владимир"", ""Киев""]",Козельск,Монголы прозвали его «злым городом»
history,medium,Возвышение Москвы,Какой князь получил право сбора дани со всех русских земель для Орды?,"[""Иван Калита"", ""Дмитрий Донской"", ""Иван III"", ""Юрий Долгорукий""]",Иван Калита,Его прозвище связано с денежным мешком
history,medium,Освобождение от ордынского ига,Какое событие 1480 года ознаменовало конец ордынского ига?,"[""Стояние на Угре"", ""Куликовская битва"", ""Битва на Калке"", ""Взятие Казани""]",Стояние на Угре,Войска Ивана III и хана Ахмата стояли на разных берегах реки
history,medium,Правление Ивана IV,"Как называлась система террора, введённая Иваном Грозным в 1565 году?","[""Опричнина"", ""Земщина"", ""Местничество"", ""Кормление""]",Опричнина,Это слово происходит от слова «опричь» — кроме
history,medium,Правление Ивана IV,Какой город был взят русскими войсками в 1552 году?,"[""Казань"", ""Астрахань"", ""Крым"", ""Новгород""]",Казань,В честь этого события был построен Покровский собор в Москве
history,medium,Смутное время,"Кто возглавил Второе ополчение, освободившее Москву в 1612 году?","[""Минин и Пожарский"", ""Болотников"", ""Шуйский"", ""Скопин-Шуйский""]",Минин и Пожарский,"Один был земским старостой, другой — князем"
history,medium,Правление Петра I,Какая война длилась с 1700 по 1721 год?,"[""Северная война"", ""Семилетняя война"", ""Ливонская война"", ""Русско-турецкая война""]",Северная война,Россия воевала со Швецией за выход к Балтийскому морю
history,medium,Правление Петра I,Какое сражение 1709 года стало переломным в Северной войне?,"[""Полтавская битва"", ""Битва при Нарве"", ""Гангутское сражение"", ""Битва при Лесной""]",Полтавская битва,В этой битве была разгромлена армия Карла XII
history,medium,Дворцовые перевороты,Какой период в истории России называют «эпохой дворцовых переворотов»?,"[""1725-1762"", ""1700-1725"", ""1762-1801"", ""1801-1825""]",1725-1762,Период начался после смерти Петра I
history,medium,Правление Екатерины II,Как называлось восстание 1773-1775 годов?,"[""Восстание Пугачёва"", ""Восстание Разина"", ""Восстание Болотникова"", ""Медный бунт""]",Восстание Пугачёва,Предводитель выдавал себя за Петра III
history,medium,Отечественная война 1812 года,Какое решение было принято на совете в Филях?,"[""Оставить Москву"", ""Дать генеральное сражение"", ""Отступать на юг"", ""Просить о мире""]",Оставить Москву,Это решение принял Кутузов
history,medium,Декабристы,В каком году произошло восстание декабристов?,"[""1825"", ""1812"", ""1861"", ""1881""]",1825,"Восстание произошло в декабре, отсюда и название"
history,medium,Крымская война,Какой город был осаждён в ходе Крымской войны 1853-1856 годов?,"[""Севастополь"", ""Одесса"", ""Керчь"", ""Ялта""]",Севастополь,Оборона этого города длилась 349 дней
history,medium,Великие реформы,Какая реформа была проведена в 1864 году и создала органы местного самоуправления?,"[""Земская реформа"", ""Крестьянская реформа"", ""Военная реформа"", ""Судебная реформа""]",Земская реформа,Были созданы земские собрания и управы
history,medium,Первая русская революция,Какое событие произошло 9 января 1905 года?,"[""Кровавое воскресенье"", ""Октябрьский манифест"", ""Восстание на броненосце «Потёмкин»"", ""Московское вооружённое восстание""]",Кровавое воскресенье,Мирная демонстрация была расстреляна
history,medium,Первая мировая война,В каком году Россия вступила в Первую мировую войну?,"[""1914"", ""1913"", ""1915"", ""1916""]",1914,Война началась летом этого года
history,medium,Великая Отечественная война,Какая битва считается коренным переломом в ходе Великой Отечественной войны?,"[""Сталинградская"", ""Московская"", ""Курская"", ""Берлинская""]",Сталинградская,Битва завершилась в феврале 1943 года
history,hard,Древняя Русь,Какой системой управления пользовались древнерусские князья для сбора дани до реформы Ольги?,"[""Полюдье"", ""Повоз"", ""Кормление"", ""Местничество""]",Полюдье,Князь с дружиной объезжал подвластные территории
history,hard,Древняя Русь,"Как называлась форма землевладения в Древней Руси, передаваемая по наследству?","[""Вотчина"", ""Поместье"", ""Надел"", ""Удел""]",Вотчина,"От слова «отец», «отчина»"
history,hard,Удельная раздробленность,В каком княжестве установилась боярская республика?,"[""Новгородском"", ""Владимиро-Суздальском"", ""Галицко-Волынском"", ""Черниговском""]",Новгородском,Высшим органом власти было вече
history,hard,Церковный раскол,Кто был главным противником реформ патриарха Никона?,"[""Протопоп Аввакум"", ""Митрополит Макарий"", ""Иосиф Волоцкий"", ""Нил Сорский""]",Протопоп Аввакум,Он был сожжён за свои убеждения в 1682 году
history,hard,Правление Петра I,Какой документ 1722 года определял порядок прохождения государственной службы?,"[""Табель о рангах"", ""Генеральный регламент"", ""Духовный регламент"", ""Воинский устав""]",Табель о рангах,Документ устанавливал 14 классов чинов
history,hard,Правление Петра I,Какая административная единица была введена Петром I вместо приказов?,"[""Коллегии"", ""Министерства"", ""Департаменты"", ""Ведомства""]",Коллегии,Их было создано 12 основных
history,hard,Правление Екатерины II,"Как назывался документ 1785 года, закреплявший привилегии дворянства?","[""Жалованная грамота дворянству"", ""Манифест о вольности дворянства"", ""Указ о единонаследии"", ""Соборное уложение""]",Жалованная грамота дворянству,Документ освобождал дворян от обязательной службы
history,hard,XIX век,Какой государственный деятель разработал проект реформ «Введение к уложению государственных законов»?,"[""Сперанский"", ""Аракчеев"", ""Новосильцев"", ""Карамзин""]",Сперанский,Его проект предполагал разделение властей
history,hard,Декабристы,Какую программу разработал Павел Пестель?,"[""Русская правда"", ""Конституция"", ""Зелёная книга"", ""Статут""]",Русская правда,Это была программа Южного общества
history,hard,Общественное движение XIX века,К какому направлению относились Хомяков и Киреевский?,"[""Славянофилы"", ""Западники"", ""Народники"", ""Либералы""]",Славянофилы,Они считали Россию особой цивилизацией
history,hard,Реформы Александра II,Какой срок выкупных платежей был установлен крестьянской реформой 1861 года?,"[""49 лет"", ""25 лет"", ""99 лет"", ""30 лет""]",49 лет,Платежи были отменены досрочно в 1907 году
history,hard,Реформы Александра II,Какой принцип был введён судебной реформой 1864 года?,"[""Состязательность сторон"", ""Сословный суд"", ""Закрытые заседания"", ""Отсутствие апелляции""]",Состязательность сторон,Также были введены суды присяжных
history,hard,Народничество,Какое событие называют «хождением в народ»?,"[""Массовое движение интеллигенции в деревню 1874 года"", ""Крестьянская реформа 1861 года"", ""Восстание декабристов 1825 года"", ""Манифест 17 октября 1905 года""]",Массовое движение интеллигенции в деревню 1874 года,Революционеры пытались вести агитацию среди крестьян
history,hard,Столыпинские реформы,Что такое «отруб» в контексте столыпинской аграрной реформы?,"[""Земельный участок, выделенный из общины без переселения"", ""Земельный участок с переселением на хутор"", ""Коллективное хозяйство"", ""Арендованная земля""]","Земельный участок, выделенный из общины без переселения","В отличие от хутора, крестьянин оставался в деревне"
history,hard,Гражданская война,Как называлась экономическая политика большевиков в годы Гражданской войны?,"[""Военный коммунизм"", ""НЭП"", ""Индустриализация"", ""Коллективизация""]",Военный коммунизм,Включала продразвёрстку и национализацию
history,hard,НЭП,В каком году была введена новая экономическая политика (НЭП)?,"[""1921"", ""1917"", ""1924"", ""1929""]",1921,Решение было принято на X съезде партии
history,hard,Великая Отечественная война,Какая операция 1944 года привела к разгрому группы армий «Центр»?,"[""Операция «Багратион»"", ""Операция «Уран»"", ""Операция «Кутузов»"", ""Операция «Искра»""]",Операция «Багратион»,Операция по освобождению Белоруссии
history,hard,Холодная война,Какое событие 1962 года поставило мир на грань ядерной войны?,"[""Карибский кризис"", ""Берлинский кризис"", ""Корейская война"", ""Венгерское восстание""]",Карибский кризис,Связан с размещением ракет на Кубе
history,hard,Перестройка,Какой курс провозгласил М.С. Горбачёв в 1985 году?,"[""Ускорение социально-экономического развития"", ""Развитой социализм"", ""Оттепель"", ""Застой""]",Ускорение социально-экономического развития,Позже политика стала называться перестройкой
math,easy,Арифметика,Чему равно 15 × 4?,"[""60"", ""54"", ""64"", ""56""]",60,Умножьте 15 на 4 или посчитайте как 10×4 + 5×4
math,easy,Арифметика,Чему равно 144 ÷ 12?,"[""12"", ""11"", ""13"", ""14""]",12,"Найдите число, которое при умножении на 12 даёт 144"
math,easy,Дроби,Чему равно 1/2 + 1/4?,"[""3/4"", ""2/6"", ""1/3"", ""2/4""]",3/4,Приведите дроби к общему знаменателю
math,easy,Дроби,Какая дробь больше: 2/3 или 3/5?,"[""2/3"", ""3/5"", ""Равны"", ""Невозможно сравнить""]",2/3,Приведите дроби к общему знаменателю 15
math,easy,Проценты,Чему равно 10% от 200?,"[""20"", ""10"", ""30"", ""25""]",20,10% — это одна десятая часть числа
math,easy,Проценты,Чему равно 50% от 80?,"[""40"", ""30"", ""50"", ""45""]",40,50% — это половина числа
math,easy,Периметр,Чему равен периметр квадрата со стороной 5 см?,"[""20 см"", ""25 см"", ""15 см"", ""10 см""]",20 см,Периметр квадрата равен сумме всех его сторон
math,easy,Площадь,Чему равна площадь прямоугольника со сторонами 3 см и 7 см?,"[""21 см²"", ""20 см²"", ""10 см²"", ""24 см²""]",21 см²,Площадь прямоугольника равна произведению сторон
math,easy,Порядок действий,Чему равно 2 + 3 × 4?,"[""14"", ""20"", ""24"", ""12""]",14,"Сначала выполняется умножение, потом сложение"
math,easy,Отрицательные числа,Чему равно (−5) + 8?,"[""3"", ""−3"", ""13"", ""−13""]",3,Прибавить положительное число — значит сместиться вправо по числовой прямой
math,easy,Отрицательные числа,Чему равно (−3) × (−4)?,"[""12"", ""−12"", ""7"", ""−7""]",12,Минус на минус даёт плюс
math,easy,Степени,Чему равно 2³?,"[""8"", ""6"", ""9"", ""4""]",8,2³ означает 2 × 2 × 2
math,easy,Степени,Чему равно 5²?,"[""25"", ""10"", ""15"", ""20""]",25,5² означает 5 × 5
math,easy,Корни,Чему равен √49?,"[""7"", ""6"", ""8"", ""9""]",7,"Найдите число, которое при возведении в квадрат даёт 49"
math,easy,Корни,Чему равен √81?,"[""9"", ""8"", ""10"", ""7""]",9,"Найдите число, которое при возведении в квадрат даёт 81"
math,easy,Уравнения,Решите уравнение: x + 7 = 15,"[""8"", ""22"", ""7"", ""9""]",8,Перенесите 7 в правую часть с противоположным знаком
math,easy,Уравнения,Решите уравнение: 3x = 18,"[""6"", ""15"", ""21"", ""5""]",6,Разделите обе части на 3
math,easy,Арифметика,Сколько будет 47 + 38?,"[""85"", ""84"", ""86"", ""75""]",85,Разбейте на удобные слагаемые: 47 + 38 = 47 + 3 + 35
math,easy,Арифметика,Чему равно 92 - 56?,"[""36"", ""46"", ""34"", ""38""]",36,"Можно вычесть сначала 50, потом ещё 6"
math,easy,Арифметика,Вычислите: 12 × 7,"[""84"", ""74"", ""82"", ""94""]",84,12 × 7 = 10 × 7 + 2 × 7
math,easy,Арифметика,Чему равно 144 ÷ 12?,"[""12"", ""11"", ""13"", ""14""]",12,Какое число при умножении на 12 даёт 144?
math,easy,Дроби,Чему равна сумма 1/4 + 1/4?,"[""1/2"", ""2/8"", ""1/8"", ""2/4""]",1/2,При одинаковых знаменателях складываем числители
math,easy,Проценты,Чему равны 50% от 80?,"[""40"", ""45"", ""35"", ""50""]",40,50% — это половина числа
math,easy,Геометрия,Чему равен периметр квадрата со стороной 5 см?,"[""20 см"", ""25 см"", ""15 см"", ""10 см""]",20 см,Периметр квадрата равен сумме всех четырёх сторон
math,easy,Геометрия,Найдите площадь прямоугольника со сторонами 6 и 8 см,"[""48 см²"", ""42 см²"", ""56 см²"", ""28 см²""]",48 см²,Площадь прямоугольника равна произведению сторон
math,easy,Уравнения,Решите уравнение: x + 7 = 15,"[""8"", ""7"", ""9"", ""22""]",8,Перенесите 7 в правую часть с противоположным знаком
math,easy,Порядок действий,Вычислите: 3 + 4 × 2,"[""11"", ""14"", ""10"", ""12""]",11,"Сначала выполняется умножение, потом сложение"
math,easy,Сравнение чисел,"Какое число больше: 0,5 или 0,49?","[""0,5"", ""0,49"", ""Равны"", ""Нельзя сравнить""]","0,5",Сравните сотые доли: 50 сотых и 49 сотых
math,easy,Округление,"Округлите 3,67 до десятых","[""3,7"", ""3,6"", ""4,0"", ""3,5""]","3,7",Смотрите на цифру в разряде сотых: 7 ≥ 5
math,easy,Таблица умножения,Чему равно 9 × 8?,"[""72"", ""81"", ""63"", ""64""]",72,9 × 8 = 9 × 10 - 9 × 2
math,easy,Делимость,Какое из чисел делится на 5?,"[""45"", ""43"", ""47"", ""41""]",45,"На 5 делятся числа, оканчивающиеся на 0 или 5"
math,easy,Чётность,Какое число является нечётным?,"[""37"", ""42"", ""28"", ""16""]",37,Нечётные числа не делятся на 2
math,easy,Простые числа,Какое из чисел является простым?,"[""17"", ""15"", ""21"", ""25""]",17,Простое число делится только на 1 и на себя
math,easy,НОД,"Найдите НОД(12, 18)","[""6"", ""3"", ""12"", ""2""]",6,"Найдите наибольшее число, на которое делятся оба"
math,easy,НОК,"Найдите НОК(4, 6)","[""12"", ""24"", ""6"", ""2""]",12,"Найдите наименьшее число, которое делится на оба"
math,easy,Степени,Чему равно 2³?,"[""8"", ""6"", ""9"", ""4""]",8,2³ = 2 × 2 × 2
math,easy,Корни,Чему равен √49?,"[""7"", ""6"", ""8"", ""9""]",7,Какое число при умножении на себя даёт 49?
math,medium,Квадратные уравнения,Решите уравнение x² - 5x + 6 = 0. Найдите сумму корней.,"[""5"", ""6"", ""-5"", ""1""]",5,По теореме Виета сумма корней равна -b/a
math,medium,Системы уравнений,"Решите систему: x + y = 7, x - y = 3. Чему равен x?","[""5"", ""2"", ""4"", ""3""]",5,"Сложите оба уравнения, чтобы найти x"
math,medium,Неравенства,Решите неравенство 2x - 4 > 6. Найдите наименьшее целое решение.,"[""6"", ""5"", ""4"", ""7""]",6,"Решите как уравнение, затем выберите нужную часть числовой прямой"
math,medium,Арифметическая прогрессия,"Найдите 10-й член арифметической прогрессии: 3, 7, 11, ...","[""39"", ""43"", ""35"", ""41""]",39,"Формула n-го члена: aₙ = a₁ + d(n-1), где d = 4"
math,medium,Геометрическая прогрессия,"Найдите 5-й член геометрической прогрессии: 2, 6, 18, ...","[""162"", ""54"", ""108"", ""486""]",162,"Формула n-го члена: bₙ = b₁ × qⁿ⁻¹, где q = 3"
math,medium,Теорема Пифагора,В прямоугольном треугольнике катеты равны 6 и 8. Чему равна гипотенуза?,"[""10"", ""12"", ""14"", ""7""]",10,c² = a² + b²
math,medium,Тригонометрия,Чему равен sin 30°?,"[""0,5"", ""1"", ""0"", ""√3/2""]","0,5",Вспомните значения тригонометрических функций для стандартных углов
math,medium,Функции,Найдите значение функции f(x) = 3x - 2 при x = 4,"[""10"", ""12"", ""14"", ""8""]",10,Подставьте значение x в формулу
math,medium,Логарифмы,Чему равен log₂ 32?,"[""5"", ""4"", ""6"", ""3""]",5,"В какую степень нужно возвести 2, чтобы получить 32?"
math,medium,Комбинаторика,Сколькими способами можно выбрать 2 книги из 5?,"[""10"", ""20"", ""25"", ""15""]",10,"Используйте формулу сочетаний C(5,2)"
